{
  "meta": {
    "schema": "scene.3d.v1",
    "version": "1.0",
    "sourceSchema": "scene.v1",
    "created": "2025-09-28T16:00:00Z",
    "name": "unit-2x3-scale05"
  },
  "units": {
    "cellMeters": 0.5,
    "wallHeightMeters": 3.0,
    "wallThicknessMeters": 0.2,
    "floorThicknessMeters": 0.1,
    "lengthUnit": "meters",
    "coordinateSystem": "right-handed-y-up"
  },
  "bounds": {
    "min": { "x": 0, "y": 0, "z": 0 },
    "max": { "x": 1.0, "y": 3.0, "z": 1.5 },
    "center": { "x": 0.5, "y": 1.5, "z": 0.75 }
  },
  "tiles": {
    "floor": [
      [0, 0], [1, 0],
      [0, 1], [1, 1],
      [0, 2], [1, 2]
    ]
  },
  "edges": {
    "horizontal": [
      [0, 0], [1, 0],
      [0, 3], [1, 3]
    ],
    "vertical": [
      [0, 0], [0, 1], [0, 2],
      [2, 0], [2, 1], [2, 2]
    ]
  },
  "originOffset": {
    "x": 0,
    "z": 0
  }
}